id,title,description,impact,mitigation,severity,cvss_score,cvss_vector,finding_type,replication_steps,host_detection_techniques,network_detection_techniques,references,finding_guidance,tags
CVE-2023-44934,Remote Code Execution in Popular CMS,A vulnerability in a widely used Content Management System (CMS) allows attackers to remotely execute malicious code on affected servers.,"Attackers can take complete control of affected websites, steal sensitive data, or launch further attacks.",Update the CMS to the latest version that addresses the vulnerability (patch CVE-2023-44934).,Critical,,,Mobile,Test,Test,Test,Test,Test,Test
CVE-2022-22222,SQL Injection in E-commerce Platform,An improperly sanitized input field in a popular e-commerce platform allows attackers to inject malicious SQL code.,"Attackers can steal customer data (names, addresses, credit card information) or disrupt the functionality of the e-commerce website.",Update the e-commerce platform to the latest version that addresses the vulnerability (patch CVE-2022-22222). Implement proper input validation to prevent SQL injection attacks.,Critical,,,Mobile,Test,Test,Test,Test,Test,Test
CVE-2021-41913,Unrestricted File Upload Vulnerability,A web application has a vulnerability that allows attackers to upload unauthorized or malicious files.,"Attackers can upload malware, web shells, or other malicious files that can compromise the server or steal data.",Update the web application to the latest version that addresses the vulnerability (patch CVE-2021-41913). Implement proper file type validation and access controls to restrict unauthorized file uploads.,Critical,,,Mobile,Test,Test,Test,Test,Test,Test
CVE-2020-14504,Phishing Campaign Targeting Remote Workers,A phishing campaign targets remote workers with emails that appear to be from legitimate sources.,"Attackers can trick victims into clicking malicious links or downloading malware, potentially compromising user accounts or infecting corporate networks.",Educate employees on phishing email tactics. Implement email filtering and spam protection solutions. Encourage multi-factor authentication for sensitive access.,Critical,,,Mobile,Test,Test,Test,Test,Test,Test
CVE-2019-9999,Supply Chain Attack Targeting Open-Source Library,A popular open-source library is compromised with a malicious code injection.,"Applications that rely on the vulnerable library inherit the vulnerability, potentially exposing them to various attacks.",Update the affected library to a patched version. Maintain an inventory of third-party libraries used in applications and stay updated on their vulnerabilities.,Critical,,,Mobile,Test,Test,Test,Test,Test,Test
CVE-2024-25461,Buffer Overflow Vulnerability in Networking Device,A buffer overflow vulnerability exists in a commonly used networking device.,"Attackers could exploit this vulnerability to crash the device, potentially causing denial-of-service (DoS) or even execute arbitrary code for remote control.",Update the firmware of the networking device to the latest patched version (patch CVE-2024-25461). Segment your network to minimize the impact of a potential compromise.,Critical,,,Mobile,Test,Test,Test,Test,Test,Test
CVE-2023-44872,Privilege Escalation in Cloud Platform,A vulnerability in a cloud platform allows attackers with low privileges to escalate their access to higher privileges.,"Attackers could gain full administrative control over cloud resources, potentially leading to data breaches, unauthorized resource usage, or disruption of critical services.",Update the cloud platform to the latest version that addresses the vulnerability (patch CVE-2023-44872). Implement the principle of least privilege for user accounts to minimize the potential damage from a compromised account.,Critical,,,Mobile,Test,Test,Test,Test,Test,Test
CVE-2022-22221,Cross-Site Scripting (XSS) Vulnerability in Social Media Platform,A social media platform is vulnerable to XSS attacks where malicious code can be injected into user profiles or posts.,"Attackers can steal user session cookies, redirect users to phishing sites, or deface user profiles.",Update the social media platform app or browser extension to the latest patched version (patch CVE-2022-22221). Be cautious when clicking on links or interacting with unknown content on social media platforms.,Critical,,,Mobile,Test,Test,Test,Test,Test,Test
CVE-2021-41419,Zero-Day Exploit Targeting Router,A zero-day exploit (previously unknown vulnerability) has been discovered that targets a specific router model.,"Attackers can exploit this vulnerability to gain remote access to the router, potentially compromising the entire network behind it.",Update the router firmware to the latest patched version as soon as one becomes available (patch CVE-2021-41419). Consider using a router with a good security track record and automatic update features.,Critical,,,Mobile,Test,Test,Test,Test,Test,Test
CVE-2020-12345,Password Spraying Attack,Attackers use automated tools to try common usernames and passwords against multiple accounts.,"Attackers can gain unauthorized access to user accounts, potentially leading to data breaches, financial loss, or identity theft.",Implement strong password policies that enforce password complexity and regular password changes. Enable multi-factor authentication (MFA) for all accounts wherever possible. Educate users on good password hygiene practices.,Critical,,,Mobile,Test,Test,Test,Test,Test,Test
CVE-2024-33333,Insecure Direct Object Reference (IDOR) in File Storage Service,A vulnerability in a cloud-based file storage service allows unauthorized access to user files.,Attackers with some knowledge of a victim's account details could potentially access and download private files belonging to other users.,Update the file storage service to the latest version that addresses the vulnerability (patch CVE-2024-33333). Implement stricter access controls that limit user access only to their authorized files.,Critical,,,Mobile,Test,Test,Test,Test,Test,Test
CVE-2023-40101,Man-in-the-Middle (MitM) Attack Targeting VPN,A vulnerability in a VPN software allows attackers to intercept and potentially manipulate data transmitted through the VPN tunnel.,"Attackers could steal sensitive information (e.g., login credentials, financial data) being transmitted through the compromised VPN connection.",Update the VPN software to the latest version that addresses the vulnerability (patch CVE-2023-40101). Use reputable VPN providers with a strong security track record. Consider implementing additional security measures like network segmentation to minimize the impact of a compromised VPN connection.,Critical,,,Mobile,Test,Test,Test,Test,Test,Test
CVE-2022-19876,Local File Inclusion (LFI) Vulnerability in Web Server,An LFI vulnerability in a web server allows attackers to execute arbitrary code on the server by referencing local files.,"Attackers could potentially gain unauthorized access to the server, steal sensitive data, or deploy malware.",Update the web server software to the latest version that addresses the vulnerability (patch CVE-2022-19876). Implement security measures to restrict access to sensitive files and directories on the web server.,Critical,,,Mobile,Test,Test,Test,Test,Test,Test
CVE-2021-39872,Unpatched Third-Party Library Vulnerability,A critical vulnerability exists in a widely used third-party library but the library vendor hasn't released a patch yet.,"Applications that rely on the vulnerable library inherit the vulnerability, potentially exposing them to various attacks depending on the specific vulnerability.","While waiting for a patch from the library vendor, application developers can consider mitigating strategies like restricting functionality or isolating the vulnerable component to minimize the attack surface. Update the library to the patched version as soon as it becomes available.",Critical,,,Mobile,Test,Test,Test,Test,Test,Test
CVE-2020-10987,Insecure Bluetooth Pairing Vulnerability,A vulnerability in certain Bluetooth implementations allows attackers to pair with devices without proper authentication.,"Attackers could gain unauthorized access to Bluetooth-enabled devices, potentially stealing data or compromising functionality.",Update Bluetooth firmware on affected devices to the latest patched version (patch CVE-2020-10987). Enable encryption and authentication for Bluetooth connections whenever possible. Disable Bluetooth when not in use to reduce the attack surface.,Critical,,,Mobile,Test,Test,Test,Test,Test,Test
CVE-2024-20012,Unvalidated Input Vulnerability in Mobile App,"A mobile application does not properly validate user input, allowing attackers to inject malicious code.","Attackers could steal sensitive data (login credentials, financial information) or take control of user accounts within the app.",Update the mobile app to the latest version that addresses the vulnerability (patch CVE-2024-20012). Implement proper input validation techniques on the server-side to prevent malicious code injection.,Critical,,,Mobile,Test,Test,Test,Test,Test,Test
CVE-2023-42424,Denial-of-Service (DoS) Attack Targeting DNS Server,"A DoS vulnerability in a DNS server can be exploited to overwhelm it with requests, causing it to become unavailable to legitimate users.","Users relying on the affected DNS server would be unable to resolve domain names to IP addresses, effectively disrupting internet access.",Update the DNS server software to the latest patched version (patch CVE-2023-42424). Implement DDoS mitigation strategies such as rate limiting and traffic filtering.,Critical,,,Mobile,Test,Test,Test,Test,Test,Test
CVE-2022-21212,Insecure Password Storage,"A web application stores user passwords in a format that is easily reversible (e.g., plain text).",Attackers who gain access to the application's database could steal user passwords and potentially compromise accounts.,Implement secure password hashing algorithms like bcrypt or scrypt to store user passwords. Enforce strong password policies and encourage multi-factor authentication.,Critical,,,Mobile,Test,Test,Test,Test,Test,Test
CVE-2021-40404,Remote Code Execution (RCE) Vulnerability in Web Framework,A vulnerability in a popular web framework allows attackers to execute arbitrary code on affected web servers.,"Attackers could take complete control of compromised servers, steal sensitive data, or deploy malware to launch further attacks.",Update the web framework to the latest version that addresses the vulnerability (patch CVE-2021-40404). Keep web applications and underlying frameworks up-to-date with the latest security patches.,Critical,,,Mobile,Test,Test,Test,Test,Test,Test
CVE-2020-11111,Phishing Attack Targeting Online Banking,A phishing campaign targets online banking users with emails that appear to be from their bank.,Attackers can trick victims into revealing login credentials or clicking on malicious links that steal financial information.,"Educate users on phishing email tactics. Encourage multi-factor authentication for online banking transactions. Use strong passwords and be cautious when clicking on links or opening attachments in emails, especially from unknown senders.",Critical,,,Mobile,Test,Test,Test,Test,Test,Test
CVE-2024-29876,SQL Injection Vulnerability in Database Management System,A vulnerability in a database management system allows attackers to inject malicious SQL code.,"Attackers could steal sensitive data stored in the database, manipulate data, or even disrupt database functionality.",Update the database management system to the latest version that addresses the vulnerability (patch CVE-2024-29876). Implement proper input validation and parameterization to prevent SQL injection attacks.,Critical,,,Mobile,Test,Test,Test,Test,Test,Test
CVE-2023-38383,Unprivileged User Account Escalation Vulnerability in Operating System,A vulnerability in a widely used operating system allows attackers with low privileges to escalate their access to administrator privileges.,"Attackers could gain complete control over the affected system, potentially compromising data, installing malware, or launching further attacks.",Update the operating system to the latest version that addresses the vulnerability (patch CVE-2023-38383). Implement the principle of least privilege for user accounts and avoid granting unnecessary administrative rights to users.,Critical,,,Mobile,Test,Test,Test,Test,Test,Test
CVE-2022-20202,Cross-Site Request Forgery (CSRF) Vulnerability in E-commerce Platform,A CSRF vulnerability in an e-commerce platform allows attackers to trick authenticated users into performing unintended actions.,"Attackers could potentially steal money from user accounts, modify purchase orders, or perform other unauthorized actions on behalf of the victim.",Update the e-commerce platform to the latest version that addresses the vulnerability (patch CVE-2022-20202). Implement CSRF protection mechanisms like anti-CSRF tokens to prevent unauthorized actions.,Critical,,,Mobile,Test,Test,Test,Test,Test,Test
CVE-2021-37373,Unpatched Open-Source Software Vulnerability,A critical vulnerability exists in a popular open-source software project but the maintainers haven't released a patch yet.,"Applications that rely on the vulnerable software inherit the vulnerability, potentially exposing them to various attacks depending on the specific issue.","While waiting for a patch, application developers can consider temporary workarounds or mitigation strategies to minimize the attack surface. Update",Critical,,,Mobile,Test,Test,Test,Test,Test,Test
